{"accepted_ceilings":["HOSTILE_SAME_UID_PRELAUNCH_PATH_REPLACEMENT","LOCAL_TERMINAL_PARTIAL_WRITE_OR_RECORDING_NOT_INDEPENDENTLY_ATTESTABLE","READ_ATIME_SIDE_EFFECT_NOT_INDEPENDENTLY_ATTESTABLE","READ_ONLY_AUTHORIZATION_CONSUMPTION_NOT_DURABLY_RECORDED","PROCESS_MEMORY_ZEROIZATION_NOT_INDEPENDENTLY_ATTESTABLE"],"approval_discovery":{"filename_pattern":"^lovable-toc-operator-identity-recovery-metadata-approval-([0-9a-f]{40})-[0-9a-f]{16}[.]json$","home_resolution":"passwd_database_effective_uid","relative_parent":"Library/Application Support/focus-flow-score/migration-approvals/toc-operator-identity-recovery-metadata","required_file_mode":"0400","required_file_nlink":1,"required_parent_mode":"0700","selection":"exactly_one_matching_current_checkout"},"artifact_kind":"lovable_toc_operator_identity_recovery_metadata_profile","checkout_policy":{"approval_source":"separate_external_owner_private_artifact","mode":"exact_checkout","same_uid_prelaunch_replacement_ceiling":true},"format_version":1,"ordinary_execution_approval_dependency":{"exact_current_checkout":true,"public_verifier":"shared_ordinary_pre_private","required":true,"selection":"exactly_one_matching_current_checkout"},"output_contract":{"artifact_kind":"lovable_toc_operator_identity_recovery_metadata","destination":"held_verified_tty_only","encoding":"canonical_compact_sorted_ascii_json_lf","format_version":1,"maximum_bytes":16384,"metadata_results_per_invocation":1,"ordinary_diagnostics":"fixed_categorical_only","prohibited_fields":["operator_identity","primary_operator_identity","identity_length","identity_prefix","identity_suffix","identity_encoding","identity_sha256","identity_fingerprint","release_token","checkpoint_entries","decisions","capture_metadata","raw_private_json","arbitrary_filenames","mismatch_details","exceptions"]},"permitted_private_reads":["operator_session_root_descriptor_metadata","operator_session_root_exact_namespace","root_authorization_v1_canonical_bytes","current_generation_one_resume_v2_canonical_bytes","annotation_root_descriptor_metadata","annotation_root_exact_namespace","checkpoints_directory_descriptor_metadata","checkpoints_exact_namespace","generation_one_checkpoint_v1_canonical_bytes","AUTHORING_RELEASED_stable_bytes"],"procedure_identity_formula":{"algorithm":"sha256_canonical_json_lf","files":["scripts/migration/author-lovable-toc-annotations.py","scripts/migration/author-lovable-toc-operator-session.py","scripts/migration/lib/lovable_toc_authoring_contract.py","scripts/migration/lib/lovable_toc_contract.py","scripts/migration/lib/lovable_toc_operator_identity_recovery.py","scripts/migration/lib/lovable_toc_operator_identity_recovery_metadata.py","scripts/migration/lib/lovable_toc_operator_preflight.py","scripts/migration/probe-lovable-toc-operator-identity-recovery-metadata.py","scripts/migration/run-lovable-toc-annotation-operator-session.sh","scripts/migration/run-lovable-toc-operator-identity-recovery-metadata-probe.sh","scripts/migration/verification/lovable-toc-annotation-checkpoint.schema.json","scripts/migration/verification/lovable-toc-operator-execution-profile-approval.schema.json","scripts/migration/verification/lovable-toc-operator-execution-profile.schema.json","scripts/migration/verification/lovable-toc-operator-execution-profile.v1.json","scripts/migration/verification/lovable-toc-operator-identity-recovery-metadata-approval.schema.json","scripts/migration/verification/lovable-toc-operator-identity-recovery-metadata-profile.schema.json","scripts/migration/verification/lovable-toc-operator-identity-recovery-metadata-profile.v1.json","scripts/migration/verification/lovable-toc-operator-identity-recovery-metadata-result.schema.json","scripts/migration/verification/lovable-toc-operator-session-authorization.schema.json","scripts/migration/verification/lovable-toc-operator-session-resume.schema.json"],"include_execution_checkout_sha":true},"prohibited_effects":["approval_mutation","annotation_decision_mutation","audit_record_creation","authoring_action_dispatch","bytecode_write","cache_creation","capture_package_access","checkpoint_mutation","chmod","create","database_access","directory_fsync","file_fsync","identity_disclosure","link","lock_creation","marker_creation","mkdir","network_access","raw_toc_access","receipt_creation","recovery_action_dispatch","recovery_evidence_access","rename","restore_command_generation","root_authorization_mutation","runtime_access","subprocess_after_public_preflight","unlink","write","validator_invocation"],"python_policy":{"absolute_path":"/Library/Developer/CommandLineTools/Library/Frameworks/Python3.framework/Versions/3.9/bin/python3.9","exact_gid":0,"exact_mode":"0755","exact_nlink":1,"exact_uid":0,"executable_required":true,"isolated_flags":["-I","-S","-B"],"reported_version":"cpython:3.9.6","sha256":"4b42b1a117605cafc8607b67b0892a609c2cd125012dd56288abeed8c89cdfb1","symlink_components_forbidden":true},"record_versions":{"checkpoint":[1],"resume":[2],"root_authorization":[1]},"recovery_metadata_contract":{"authorization_consumption":"procedural_on_first_private_pathname_operation","challenge_phrase_prefix":"AUTHORIZE PROBE_RECOVERY_METADATA","expected_generation":1,"expected_predecessor":"absent","expected_state":"PRIMARY_REVIEW_REQUIRED","identity_comparison":"internal_equality_only","identity_disclosure":"forbidden","no_retry_acknowledgement":"NO_RETRY_AFTER_PRIVATE_ACCESS","ordinary_action_dispatched":false,"private_mutation":"forbidden","recovery_action_dispatched":false},"repository":{"name":"focus-flow-score","owner":"starstruck86"},"reviewed_files":["scripts/migration/author-lovable-toc-annotations.py","scripts/migration/author-lovable-toc-operator-session.py","scripts/migration/lib/lovable_toc_authoring_contract.py","scripts/migration/lib/lovable_toc_contract.py","scripts/migration/lib/lovable_toc_operator_identity_recovery.py","scripts/migration/lib/lovable_toc_operator_identity_recovery_metadata.py","scripts/migration/lib/lovable_toc_operator_preflight.py","scripts/migration/probe-lovable-toc-operator-identity-recovery-metadata.py","scripts/migration/run-lovable-toc-annotation-operator-session.sh","scripts/migration/run-lovable-toc-operator-identity-recovery-metadata-probe.sh","scripts/migration/verification/lovable-toc-annotation-checkpoint.schema.json","scripts/migration/verification/lovable-toc-operator-execution-profile-approval.schema.json","scripts/migration/verification/lovable-toc-operator-execution-profile.schema.json","scripts/migration/verification/lovable-toc-operator-execution-profile.v1.json","scripts/migration/verification/lovable-toc-operator-identity-recovery-metadata-approval.schema.json","scripts/migration/verification/lovable-toc-operator-identity-recovery-metadata-profile.schema.json","scripts/migration/verification/lovable-toc-operator-identity-recovery-metadata-profile.v1.json","scripts/migration/verification/lovable-toc-operator-identity-recovery-metadata-result.schema.json","scripts/migration/verification/lovable-toc-operator-session-authorization.schema.json","scripts/migration/verification/lovable-toc-operator-session-resume.schema.json"],"verification_labels":["checkout_verified","metadata_approval_verified","metadata_procedure_verified","ordinary_execution_approval_verified","profile_verified","python_verified","repository_verified","reviewed_files_verified","tty_verified"]}
